{
  "id": "earth_arkham_city_northside_Boundary_St_001",
  "name": "Boundary Street (West)",
  "description": "The western end of Boundary Street, which forms the northern boundary of Arkham's developed area. Working-class homes and small workshops line the street, their modest facades reflecting the honest labor of their inhabitants. The air carries the scent of coal smoke and industry from the nearby mills.",
  "plane": "earth",
  "zone": "arkham_city",
  "sub_zone": "northside",
  "environment": "outdoors",
  "exits": {
    "north": null,
    "south": null,
    "east": "earth_arkham_city_northside_Boundary_St_002",
    "west": null,
    "up": null,
    "down": null
  }
}
