{
  "id": "earth_arkham_city_lower_southside_W_Washington_St_001",
  "name": "W. Washington Street (West)",
  "description": "The western end of W. Washington Street in the Lower Southside district. The street is lined with decrepit buildings that seem to lean inward as if trying to hide their secrets. The air carries the scent of decay and something that makes the skin crawl.",
  "plane": "earth",
  "zone": "arkham_city",
  "sub_zone": "lower_southside",
  "environment": "outdoors",
  "exits": {
    "north": null,
    "south": null,
    "east": "earth_arkham_city_lower_southside_W_Washington_St_002",
    "west": null,
    "up": null,
    "down": null
  }
}
