{
  "id": "earth_arkham_city_northside_Jenkin_St_001",
  "name": "Jenkin Street (Northside South)",
  "description": "The southern end of Jenkin Street in the Northside district. The street is lined with modest worker housing, with small but well-kept homes. The air carries the scent of honest labor and industry.",
  "plane": "earth",
  "zone": "arkham_city",
  "sub_zone": "northside",
  "environment": "outdoors",
  "exits": {
    "north": "earth_arkham_city_northside_Jenkin_St_002",
    "south": null,
    "east": null,
    "west": null,
    "up": null,
    "down": null
  }
}
