{
  "id": "earth_arkham_city_campus_E_College_St_003",
  "name": "E. College Street (East)",
  "description": "The eastern end of E. College Street, where it approaches the intersection with the main campus thoroughfares. The buildings here are the most recently constructed, though their architecture seems to incorporate elements that predate the university's founding.",
  "plane": "earth",
  "zone": "arkham_city",
  "sub_zone": "campus",
  "environment": "outdoors",
  "exits": {
    "north": null,
    "south": null,
    "east": null,
    "west": "earth_arkham_city_campus_E_College_St_002",
    "up": null,
    "down": null
  }
}
