{
  "id": "earth_arkham_city_northside_Derby_St_012",
  "name": "W. Derby Street",
  "description": "W. Derby Street 012",
  "plane": "earth",
  "zone": "arkham_city",
  "sub_zone": "northside",
  "environment": "outdoors",
  "exits": {
    "north": null,
    "south": null,
    "east": "earth_arkham_city_intersection_Derby_Gedney",
    "west": "earth_arkham_city_northside_Derby_St_011",
    "up": null,
    "down": null
  }
}
