{
  "id": "earth_arkham_city_intersection_Derby_Garrison",
  "name": "Derby and N. Garrison Street Intersection",
  "description": "The intersection where Derby Street meets N. Garrison Street",
  "plane": "earth",
  "zone": "arkham_city",
  "sub_zone": "downtown",
  "environment": "outdoors",
  "exits": {
    "north": "earth_arkham_city_northside_Garrison_St_002",
    "south": "earth_arkham_city_northside_Garrison_St_003",
    "east": "earth_arkham_city_downtown_Derby_St_001",
    "west": "earth_arkham_city_northside_Derby_St_014",
    "up": null,
    "down": null
  }
}
