{
  "id": "earth_arkham_city_downtown_Federal_St_005",
  "name": "Federal Street (East)",
  "description": "The eastern end of Federal Street, where the formal government buildings give way to more commercial enterprises. A few banks and insurance companies maintain offices here, taking advantage of the street's prestigious address while being slightly removed from the governmental bustle.",
  "plane": "earth",
  "zone": "arkham_city",
  "sub_zone": "downtown",
  "environment": "outdoors",
  "exits": {
    "north": null,
    "south": null,
    "east": null,
    "west": "earth_arkham_city_downtown_Federal_St_004",
    "up": null,
    "down": null
  }
}
