{
  "id": "earth_arkham_city_northside_room_derby_st_011",
  "name": "W. Derby Street",
  "description": "This section of W. Derby Street features a small, neglected garden behind a wrought-iron fence. Twisted rose bushes claw at the air with thorny fingers, and the ground seems to absorb sound like a sponge. The houses here have an almost predatory aspect.",
  "plane": "earth",
  "zone": "arkham_city",
  "sub_zone": "northside",
  "environment": "outdoors",
  "exits": {
    "north": null,
    "south": null,
    "east": "earth_arkham_city_northside_derby_st_012",
    "west": "earth_arkham_city_northside_derby_st_010",
    "up": null,
    "down": null
  }
}